{
    "$schema": "https://json-schema.org/draft/2020-12/schema",
    "title": "Samsara Function Import Metadata",
    "type": "object",
    "additionalProperties": false,
    "properties": {
        "$schema": {
            "type": "string",
            "description": "JSON Schema declaration for IDE support"
        },
        "name": {
            "type": "string",
            "minLength": 3,
            "maxLength": 35,
            "pattern": "^[a-zA-Z0-9_-]+$"
        },
        "description": {
            "type": "string"
        },
        "activitySchemaInput": {
            "type": "object"
        },
        "eventParameters": {
            "type": "object",
            "propertyNames": {
                "type": "string",
                "minLength": 1
            },
            "additionalProperties": {
                "type": "string"
            }
        },
        "secretsKeys": {
            "type": "array",
            "uniqueItems": true,
            "items": {
                "type": "string",
                "minLength": 1
            }
        },
        "isSchedulingEnabled": {
            "type": "boolean"
        },
        "schedule": {
            "type": "object",
            "additionalProperties": false,
            "properties": {
                "entries": {
                    "type": "array",
                    "minItems": 1,
                    "items": {
                        "type": "object",
                        "additionalProperties": false,
                        "properties": {
                            "timeSinceMidnightMs": {
                                "type": "integer",
                                "minimum": 0,
                                "maximum": 86399999
                            },
                            "daysOfWeek": {
                                "type": "array",
                                "items": { "type": "boolean" },
                                "minItems": 7,
                                "maxItems": 7,
                                "contains": { "const": true },
                                "minContains": 1
                            }
                        },
                        "required": [
                            "timeSinceMidnightMs",
                            "daysOfWeek"
                        ]
                    }
                }
            },
            "required": ["entries"]
        },
        "handler": {
            "type": "string",
            "pattern": "^[A-Za-z0-9_./-]+\\.[A-Za-z_$][A-Za-z0-9_$]*$",
            "description": "AWS Lambda handler in module.export format"
        }
    }
}